id,subcategory,type_of_question,category,difficulty_score,difficulty_band,concept_difficulty,operations_required,problem_structure,solution_method,core_concepts,concept_extraction_status,quality_verified,created_at
e945c2c0-1924-49c8-b6f5-98a71c900565,Ratios and Proportions,Direct and Inverse Variation,Arithmetic,2.50,Medium,"{""prerequisites"": [""understanding of ratios"", ""basic algebra""], ""cognitive_barriers"": [""interpreting percentage change""], ""mastery_indicators"": [""ability to set up and solve equations""]}","[""substitution"", ""simplification""]",linear equation setup and manipulation,algebraic manipulation and substitution,"[""ratios"", ""proportions"", ""percentage increase""]",completed,True,2025-09-08 15:01:22.187599
9ef24751-0865-4eee-8cb3-bdeb43899e8b,Ratios and Proportions,Simple Rations,Arithmetic,2.50,Medium,"{""prerequisites"": [""understanding of ratios"", ""basic multiplication""], ""cognitive_barriers"": [""identifying least common multiple""], ""mastery_indicators"": [""ability to manipulate ratios and multiples""]}","[""multiplication"", ""division"", ""finding LCM""]",ratio and multiple constraints,"Set up equations based on given ratios and conditions, solve for minimum values.","[""ratios"", ""multiples"", ""least common multiple""]",completed,True,2025-09-08 15:01:22.188596
1ac0f44e-5498-4515-afd0-2220ab23f9c9,Ratios and Proportions,Simple Rations,Arithmetic,2.50,Medium,"{""prerequisites"": [""understanding of ratios"", ""basic algebra""], ""cognitive_barriers"": [""translating word problem into equations""], ""mastery_indicators"": [""correctly setting up and solving the inequality""]}","[""algebraic manipulation"", ""inequality solving""]",linear equation with inequality constraint,Set up a ratio equation and solve for the maximum integer value under a constraint.,"[""ratios"", ""proportions"", ""inequalities""]",completed,True,2025-09-08 15:01:22.188263
19ce20fc-0cb3-4460-9a1f-42c27cd907cf,Ratios and Proportions,Simple Rations,Arithmetic,2.50,Medium,"{""prerequisites"": [""understanding of ratios"", ""basic algebra""], ""cognitive_barriers"": [""setting up equations correctly"", ""interpreting ratio changes""], ""mastery_indicators"": [""ability to manipulate ratios"", ""solving linear equations""]}","[""algebraic manipulation"", ""equation solving""]",ratio transformation,"Set up equations based on initial and final ratios, solve for the number of items transferred.","[""ratios"", ""proportions"", ""algebraic manipulation""]",completed,True,2025-09-08 15:01:22.187777
07949196-c567-45aa-b123-114f3dfe2399,Ratios and Proportions,Simple Rations,Arithmetic,2.50,Medium,"{""prerequisites"": [""understanding of ratios"", ""basic algebra""], ""cognitive_barriers"": [""setting up equations correctly""], ""mastery_indicators"": [""ability to manipulate and solve ratio equations""]}","[""algebraic manipulation"", ""solving linear equations""]",linear relationship between scores and their increments,Set up equations based on given ratios and solve for the unknown increase.,"[""ratios"", ""proportions"", ""linear equations""]",completed,True,2025-09-08 15:01:22.187855
e1e02ff6-6c5d-45fc-91d9-f8dada0207c1,Ratios and Proportions,Simple Rations,Arithmetic,2.50,Medium,"{""prerequisites"": [""understanding of percentages"", ""basic ratio calculations""], ""cognitive_barriers"": [""interpreting percentage in terms of total salary"", ""relating total and average salaries""], ""mastery_indicators"": [""correctly setting up and solving ratio equations""]}","[""percentage calculation"", ""ratio calculation""]",relational analysis between groups,Set up equations based on given percentages and solve for the ratio of averages.,"[""ratios"", ""percentages"", ""average salary""]",completed,True,2025-09-08 15:01:22.188441
e038380d-f453-4bdc-b2fe-4a230ca48b98,Simple and Compound Interest,Basics,Arithmetic,2.50,Medium,"{""prerequisites"": [""Understanding of simple interest"", ""Basic algebra""], ""cognitive_barriers"": [""Setting up equations correctly"", ""Solving linear equations""], ""mastery_indicators"": [""Ability to equate and solve interest equations""]}","[""Multiplication"", ""Subtraction"", ""Division""]",Linear equation setup and solving,Set up equations for simple interest and solve for equality,"[""Simple Interest"", ""Linear Equations""]",completed,True,2025-09-08 15:01:22.188051
af94120b-9938-4746-a949-10c77931c132,Simple and Compound Interest,Basics,Arithmetic,2.50,Medium,"{""prerequisites"": [""Understanding of simple interest"", ""Basic algebra""], ""cognitive_barriers"": [""Combining different interest rates"", ""Understanding proportional investments""], ""mastery_indicators"": [""Correctly calculating total interest"", ""Solving for time in interest problems""]}","[""Fraction operations"", ""Algebraic manipulation""]",Multi-part investment with different interest rates,"Break down the capital into parts, calculate interest for each part, sum up the interests, and solve for time.","[""Simple Interest"", ""Proportional Investment"", ""Interest Rate Calculation""]",completed,True,2025-09-08 15:01:22.188254
d056cef0-cff9-42d8-949a-dee3a694694d,Simple and Compound Interest,Basics,Arithmetic,2.50,Medium,"{""prerequisites"": [""Understanding of simple interest formula"", ""Basic algebraic manipulation""], ""cognitive_barriers"": [""Setting up equations correctly"", ""Interpreting percentage of total""], ""mastery_indicators"": [""Ability to equate and solve interest equations"", ""Correctly calculating percentage""]}","[""Algebraic manipulation"", ""Ratio and proportion"", ""Percentage calculation""]",Equating two expressions and solving for unknowns,Equating simple interests and solving for the ratio of investments,"[""Simple Interest"", ""Proportionality"", ""Percentage Calculation""]",completed,True,2025-09-08 15:01:22.188259
