id,subcategory,type_of_question,category,difficulty_score,difficulty_band,pyq_frequency_score,concept_difficulty,operations_required,problem_structure,solution_method,core_concepts,answer_match,concept_extraction_status,quality_verified,created_at
7746bcdb-ee4e-4b16-9e41-9920abee0e20,Percentages,Basics,Arithmetic,2.75,Hard,1.0000,"{""prerequisites"": [""basic algebra"", ""understanding of percentages""], ""cognitive_barriers"": [""translating word problems into equations""], ""mastery_indicators"": [""ability to set up and solve equations from word problems""]}","[""multiplication"", ""addition"", ""subtraction"", ""division""]",linear relationship and percentage calculation,algebraic manipulation and percentage calculation,"[""percentage"", ""proportional reasoning"", ""algebraic expressions""]",True,completed,True,2025-09-11 17:46:28.779033
8e8b92ba-ea52-44e4-be03-33c3db66e9e9,Profit-Loss-Discount,Marked Price and Cost Price Relations,Arithmetic,2.75,Hard,1.0000,"{""prerequisites"": [""Basic Algebra"", ""Understanding of Profit and Loss""], ""cognitive_barriers"": [""Complex equation setup"", ""Multiple percentage calculations""], ""mastery_indicators"": [""Ability to set up and solve equations"", ""Understanding of profit calculations""]}","[""Multiplication"", ""Addition"", ""Subtraction"", ""Division""]",Multi-step calculation with variable manipulation,Algebraic manipulation and percentage calculations,"[""Profit and Loss"", ""Percentage"", ""Algebraic Equations""]",True,completed,True,2025-09-11 17:58:11.333741
16e603d2-369c-4839-b2c0-09c8a1b1bb50,Profit-Loss-Discount,Marked Price and Cost Price Relations,Arithmetic,2.75,Hard,1.0000,"{""prerequisites"": [""Basic algebra"", ""Understanding of percentages""], ""cognitive_barriers"": [""Complex multi-step calculations"", ""Integration of multiple concepts""], ""mastery_indicators"": [""Ability to calculate profit and loss"", ""Proficiency in percentage calculations""]}","[""Multiplication"", ""Division"", ""Subtraction"", ""Percentage calculation""]",Multi-step problem with sequential calculations,Algebraic manipulation and percentage calculation,"[""Profit and Loss"", ""Percentage"", ""Discount""]",True,completed,True,2025-09-11 17:43:51.255860
e0a6548b-c186-47fa-80d9-2e1c2a95c37c,Profit-Loss-Discount,Basics,Arithmetic,2.75,Hard,1.0000,"{""prerequisites"": [""basic algebra"", ""understanding of percentages""], ""cognitive_barriers"": [""setting up equations from word problems""], ""mastery_indicators"": [""ability to solve linear equations"", ""correct interpretation of profit and loss scenarios""]}","[""addition"", ""subtraction"", ""multiplication"", ""division""]",two-variable linear system,algebraic manipulation and solving system of equations,"[""linear equations"", ""profit and loss"", ""system of equations""]",True,completed,True,2025-09-11 17:57:47.210305
b55636a6-cc3f-454c-a0aa-a86b8ca2524e,Profit-Loss-Discount,Basics,Arithmetic,2.75,Hard,1.0000,"{""prerequisites"": [""Basic arithmetic"", ""Understanding of percentages""], ""cognitive_barriers"": [""Sequential transaction analysis"", ""Reverse calculation of profit""], ""mastery_indicators"": [""Ability to calculate profit/loss in multi-step transactions""]}","[""Multiplication"", ""Subtraction"", ""Addition"", ""Percentage calculation""]",Sequential transaction analysis,Sequential profit and loss calculation,"[""Profit and Loss"", ""Percentage Calculation"", ""Sequential Transactions""]",True,completed,True,2025-09-11 17:44:30.317905
